{
  "schema_version": 1,
  "as_of": "2026-10-16T08:58:30Z",
  "sources": [
    "defillama_yields",
    "defillama_stablecoins",
    "rpc_aave_pool"
  ],
  "protocol": "aave-v3",
  "token": "USDC",
  "pool_tvl_usd": "120000000.00",
  "reward_apy_share_bps": 1200,
  "apy_deviation_bps": 80,
  "stablecoin_depeg_bps": 6,
  "utilization_bps": 7400,
  "estimated_slippage_bps": null,
  "estimated_cost_usd": "0.40",
  "estimated_benefit_usd": "3.10",
  "data_age_seconds": 90
}
